1, Our National Defence must be very strong to deter and foil any unfriendly nations.
2, Establish strong repository of arms and ammunition.
3, Establish strong line of defence by investing in more jobs for putting person with faith in defending the nation.
4, We favour investment in stock and commodity exchanges. 
5, We believe in strength of gold and holing gold as one of the assets of the nation. 
6, We believe that best defended of the nation is to have aggressive foreign policy.
7, War is also a means to defend the nation at the same time strengthen the economy of your country.
8, Taking War to other nation is best policy than to have to defend one from unfriendly nations.