0058f644-1225-4391-8c2e-5d352ccb921e,Brainverse,8909,830817.49,2013-09-09 02:05:59,\N,11,4,icon icon-candidate ,9795.35,64,Nulla facilisi. Cras non velit nec nisi vulputate nonummy. Maecenas tincidunt lacus at velit.,D,hr
006d4245-cb95-49c2-8468-4df284069970,Tazzy,9592,968211.55,2013-08-21 02:11:01,\N,11,2,icon icon-candidate ,7956.85,50,Sed vel enim sit amet nunc viverra dapibus. Nulla suscipit ligula in lacus.,A,hu
011e7365-18e8-4c23-a9f1-43441c1160d8,Devpulse,8484,897587.62,2014-02-09 11:12:53,\N,6,1,icon icon-candidate ,4115.9,98,Sed vel enim sit amet nunc viverra dapibus.,D,ge
01380bdf-50df-4df3-894d-f95f94d1603d,Fivespan,9569,213723.64,2013-12-01 08:29:41,\N,12,4,icon icon-candidate ,8144.83,34,Integer ac leo.,A,sa
01732875-0ea9-470e-8e16-f9ddb828cc0b,Kazio,9931,247760.59,2013-04-06 16:17:25,\N,9,2,icon icon-candidate ,6191.57,44,Vestibulum ante ipsum primis in faucibus orci luctus et ultrices posuere cubilia Curae; Mauris viverra diam vitae quam. Suspendisse potenti. Nullam porttitor lacus at turpis.,C,fr
01a6ed31-d7e8-4868-8414-b8a84ed74efe,Zoovu,8836,671639.31,2013-08-23 09:49:26,\N,7,1,icon icon-candidate ,8975.78,35,Nunc rhoncus dui vel sem.,C,mr
01d11f01-a0ee-4433-b031-f8161bf6e5ee,Shuffledrive,9341,535820.13,2013-10-28 21:20:31,\N,6,2,icon icon-candidate ,6446.69,70,Suspendisse potenti. Cras in purus eu magna vulputate luctus.,P,gt
023a4dec-7de4-4746-b887-50e506104db7,Gigaclub,9852,79955.62,2014-01-10 15:34:22,\N,6,1,icon icon-candidate ,9085.68,97,Proin eu mi.,P,no
0262aa65-93e3-44cf-bd9c-c1716fc50a25,Mybuzz,9039,940726.46,2014-02-27 18:11:56,\N,13,3,icon icon-candidate ,8362.69,61,Nullam sit amet turpis elementum ligula vehicula consequat. Morbi a ipsum.,A,do
03695b29-012a-4c7f-a536-b4e68d13b42d,Jetpulse,9106,408380.82,2013-11-04 12:33:43,\N,8,1,icon icon-candidate ,4209.03,25,In est risus\t\t t,,
037536c9-1ef7-4556-b497-906f6c1d7174,Bubbletube,9610,399410.83,2013-05-24 15:00:20,\N,11,2,icon icon-candidate ,5465.57,29,Vivamus tortor.,C,at
038f6db1-9bb7-4073-b84e-67e3bcee60f4,Edgetag,8174,128137.16,2013-04-09 18:14:43,\N,5,1,icon icon-candidate ,3467.06,66,Vivamus tortor. Duis mattis egestas metus.,A,ad
040cd9d6-625a-4f42-908d-90d4816c24e0,Gevee,9711,741230.82,2014-01-14 13:36:32,\N,16,4,icon icon-candidate ,5927.18,71,Nulla tellus. In sagittis dui vel nisl. Duis ac nibh.,P,gr
05841738-2105-4e41-a803-440bd78f0994,Latz,9201,883378.26,2013-08-15 02:46:24,\N,10,4,icon icon-candidate ,6238.93,59,In blandit ultrices enim. Lorem ipsum dolor sit amet\t\tC,,
061f8d57-9b06-43ce-a23c-dc1afe59d074,Wordify,8532,323888.47,2013-07-13 04:28:40,\N,14,2,icon icon-candidate ,72.16,57,In est risus\t\t t,,
0634560a-68b2-4199-953f-60c5cc28f171,Jatri,5797,755429.23,2013-11-10 17:35:59,\N,1,1,icon icon-candidate ,7785.17,94,Vestibulum rutrum rutrum neque.,A,do
06dc6a8e-7426-4dc2-ae2b-d1c254dee8fc,Devshare,7634,905865.93,2013-12-17 10:09:31,\N,6,2,icon icon-candidate ,86.7,3,Nulla neque libero\t\t e,,
075d6c2e-c661-4fa2-9339-2a80a56ac489,Riffpedia,9029,917322.33,2013-05-13 11:22:43,\N,9,5,icon icon-candidate ,3015.5,86,Duis aliquam convallis nunc. Proin at turpis a pede posuere nonummy. Integer non velit.,P,tr
07a6497e-46c0-4072-b674-6437f74b013c,Pixonyx,9570,54050.1,2013-11-06 19:03:17,\N,10,2,icon icon-candidate ,8702.03,82,Etiam vel augue.,D,lt
07af852c-1f50-49a7-afa1-b070d35bdc74,Skiba,9892,792888.93,2013-06-10 12:56:26,\N,10,3,icon icon-candidate ,7969.08,95,In est risus\t\t t,,
083fe981-a1c7-409e-a8a2-e6040cd02d8c,Flashdog,8677,784763.85,2013-10-08 11:21:37,\N,10,4,icon icon-candidate ,9107.12,37,Nullam orci pede\t\t s,,
085afb33-b356-44ad-9e5c-9851da99d7d2,Babbleblab,9578,93516.36,2013-07-04 05:37:28,\N,14,6,icon icon-candidate ,870.4,6,Donec odio justo\t\t s,,
085dc280-57c0-4912-859c-ede535360278,Snaptags,9461,747797.37,2013-05-22 08:06:03,\N,6,3,icon icon-candidate ,6850.61,64,In eleifend quam a odio.,P,tn
09fb72dd-2f20-40ba-884b-799a33415afb,Kanoodle,9474,534752.16,2013-08-06 02:40:33,\N,14,2,icon icon-candidate ,69.32,59,Duis mattis egestas metus. Aenean fermentum. Donec ut mauris eget massa tempor convallis.,A,fr
0a55b0a1-892d-47eb-8a86-e473734d4dfe,Skinder,9945,979555.96,2013-06-14 21:11:37,\N,6,5,icon icon-candidate ,5876.23,18,Cras non velit nec nisi vulputate nonummy.,C,fr
0a664299-ffc2-4fa8-8b77-95f8104845d1,Wikizz,7887,59165.49,2013-12-13 16:38:00,\N,9,1,icon icon-candidate ,6639.14,19,Vivamus vel nulla eget eros elementum pellentesque.,D,se
0a850340-de83-45eb-9b6d-0664e6b36b8c,Thoughtbeat,9880,203005.03,2013-04-21 09:27:37,\N,10,4,icon icon-candidate ,3407.75,72,Donec quis orci eget orci vehicula condimentum. Curabitur in libero ut massa volutpat convallis. Morbi odio odio\t\t i,,
0aa86c76-e14a-4c58-8141-e304d16f4840,Twimbo,9139,470505,2014-03-03 23:30:44,\N,14,4,icon icon-candidate ,7105.23,46,Aenean fermentum. Donec ut mauris eget massa tempor convallis. Nulla neque libero\t\t e,,
0ae1a4cb-51b9-462a-8f6c-6d05d62acb52,Zooxo,3800,863639.69,2014-02-23 07:27:54,\N,4,1,icon icon-candidate ,5499.22,87,Donec diam neque\t\t v,,
0b595694-a2d0-4706-b823-8f2b72004ce0,Fiveclub,9472,907104.14,2013-06-11 00:47:24,\N,9,3,icon icon-candidate ,6311.26,43,Nulla mollis molestie lorem.,A,fr
0b5b4d0b-9b9b-4063-8ae0-b1903c9ba085,Kare,9325,563290.04,2013-08-19 19:23:27,\N,11,2,icon icon-candidate ,2087.06,81,Mauris sit amet eros.,A,me
0b8223f9-cfe3-4247-9f54-f5f7f0bb3988,Devify,8364,128706.44,2013-11-02 11:50:47,\N,8,2,icon icon-candidate ,272.4,98,Nunc rhoncus dui vel sem. Sed sagittis. Nam congue\t\t q,,
0b8e29f7-91ff-4baf-ae44-2a0cef020e33,Meevee,9247,197815.61,2013-08-12 23:25:21,\N,9,6,icon icon-candidate ,86.68,4,Cum sociis natoque penatibus et magnis dis parturient montes\t\tC,,
0bffa9cc-00c4-468d-9cf6-902a11b61d1e,Oloo,8463,282265.64,2013-05-05 11:46:10,\N,6,1,icon icon-candidate ,9390.6,18,Nulla tellus.,A,fr
0d9a15d5-eef4-4b78-bf33-894a11e2d904,Meetz,9551,450117.89,2013-11-26 06:31:45,\N,9,3,icon icon-candidate ,2599.26,28,Duis aliquam convallis nunc. Proin at turpis a pede posuere nonummy. Integer non velit.,P,fr
0dca8472-0998-414c-aae6-1ad2e3148197,Roodel,9876,437925.08,2013-11-13 08:36:05,\N,11,2,icon icon-candidate ,6258.96,10,Quisque arcu libero\t\t l,,
0de0f253-79db-41f0-864e-e7bef7180bbd,Tavu,8711,388072.9,2013-08-30 03:47:31,\N,5,0,icon icon-candidate ,4421.11,50,Vestibulum ac est lacinia nisi venenatis tristique.,D,fr
0e14de80-f441-4239-bec6-5703caa14b68,Gabcube,9694,98474.49,2013-10-22 06:07:21,\N,13,4,icon icon-candidate ,846.76,28,Donec quis orci eget orci vehicula condimentum.,A,kz
0f2fb8bc-8758-4dc0-89cd-35e73b05a97c,Innotype,6792,39246.46,2013-06-01 08:33:15,\N,5,2,icon icon-candidate ,6372.54,46,Nullam molestie nibh in lectus. Pellentesque at nulla.,C,al
100e0a45-5a31-4dbd-a60f-cadb29725b90,Quinu,8517,941187.42,2013-11-20 16:45:19,\N,11,2,icon icon-candidate ,2823.51,3,Morbi non lectus. Aliquam sit amet diam in magna bibendum imperdiet.,P,gr
103ddf39-fc95-4893-b394-1d14ed1f0af2,Avaveo,9059,180702.08,2014-03-18 11:48:34,\N,8,0,icon icon-candidate ,7555.36,88,Integer non velit.,P,mu
10484a0a-b1ab-4e89-a13e-239237f808a5,Reallinks,9062,139500.44,2013-12-15 19:31:27,\N,8,3,icon icon-candidate ,1544.04,41,Nullam molestie nibh in lectus.,A,hu
10543719-c2b1-406b-9d75-fd780d096c3b,JumpXS,9619,957387.91,2013-06-19 06:39:08,\N,10,4,icon icon-candidate ,1223.53,99,Suspendisse potenti. In eleifend quam a odio. In hac habitasse platea dictumst.,D,ch
107dfbd3-ea06-4413-beb4-6a3baf9d3e47,Tekfly,9951,855586.26,2013-05-01 00:11:46,\N,9,1,icon icon-candidate ,2615.92,44,Suspendisse potenti. Cras in purus eu magna vulputate luctus. Cum sociis natoque penatibus et magnis dis parturient montes\t\tA,,
10f80b8f-9112-48ad-a80c-87d9abaef466,Skivee,9954,296811.47,2013-09-11 02:42:36,\N,14,5,icon icon-candidate ,7708.26,21,Duis consequat dui nec nisi volutpat eleifend. Donec ut dolor. Morbi vel lectus in quam fringilla rhoncus.,D,mu
1126364f-a634-4359-8a77-217bf4818f2f,Demivee,9350,333458.84,2013-05-06 10:34:17,\N,10,1,icon icon-candidate ,8621.39,77,Sed vel enim sit amet nunc viverra dapibus. Nulla suscipit ligula in lacus. Curabitur at ipsum ac tellus semper interdum.,P,sm
11979a2d-935d-49ae-983e-dcb43325fb2b,Lazzy,8828,691109.98,2013-12-17 06:49:59,\N,8,2,icon icon-candidate ,8373.78,25,In hac habitasse platea dictumst. Aliquam augue quam\t\t c,,
12705c55-9185-41d1-a639-ed1abc8eecdd,Mymm,9832,321230.05,2013-12-05 12:44:48,\N,16,4,icon icon-candidate ,6452.18,9,Cum sociis natoque penatibus et magnis dis parturient montes\t\t n,,
129a4ce0-67b1-49e0-b7f5-04b889cfacf6,Photobug,5644,652575.8,2013-09-03 16:34:29,\N,6,1,icon icon-candidate ,7205.62,48,Nam dui. Proin leo odio\t\t c,,
12e1ea10-b9b4-4977-aca1-8c056e7535ef,Bubblemix,8643,961112.55,2013-04-08 07:52:29,\N,8,2,icon icon-candidate ,3040.82,65,Nulla ac enim.,A,ch
13bfbe7b-e618-45d2-8827-154c88e9e05b,Dabfeed,8160,932214.15,2013-10-18 21:45:22,\N,10,3,icon icon-candidate ,3250.7,49,In est risus\t\t t,,
13f55d69-f6cd-47d5-aa81-4329fccc1b0c,Tanoodle,9770,654082.91,2013-12-09 02:42:01,\N,10,1,icon icon-candidate ,1357.34,53,Sed sagittis. Nam congue\t\t q,,
144e06d1-c9e9-4baa-b22a-3678b220427d,Vinder,9913,591694.02,2013-07-19 00:54:01,\N,15,5,icon icon-candidate ,8820.61,64,Nam nulla. Integer pede justo\t\t t,,
14aad0e9-f29c-452d-a489-6de18df1bd0d,Katz,9919,469649.36,2013-12-25 06:42:24,\N,7,0,icon icon-candidate ,2276.26,72,Nulla ac enim.,P,fr
14b2370a-c826-44df-af9b-a077e59cd013,Jayo,7946,358605.47,2013-10-13 20:25:07,\N,11,3,icon icon-candidate ,3371.4,70,Nullam sit amet turpis elementum ligula vehicula consequat. Morbi a ipsum.,P,hu
1524fcba-161c-4dbb-a327-89f0fa4307b6,Bubblemix,9816,975397.44,2013-05-30 12:17:51,\N,9,5,icon icon-candidate ,4006.16,68,Phasellus sit amet erat. Nulla tempus.,C,gr
154dd289-3a8b-4c90-b042-41967983bb9a,Gabtype,9679,238935.95,2013-07-28 13:51:21,\N,14,3,icon icon-candidate ,1735.63,89,Nulla justo. Aliquam quis turpis eget elit sodales scelerisque. Mauris sit amet eros.,D,br
1609872a-d74c-4af3-9b56-030d3a789947,Devpulse,8601,619222.84,2013-06-20 22:23:46,\N,8,4,icon icon-candidate ,2103.48,15,Lorem ipsum dolor sit amet\t\tC,,
163a9130-320c-4026-9881-aa3a02f8382e,Feednation,8280,759740.99,2013-05-26 03:57:54,\N,6,0,icon icon-candidate ,4580.3,80,Vivamus vestibulum sagittis sapien. Cum sociis natoque penatibus et magnis dis parturient montes\t\tC,,
1644a916-0d7b-4e41-b687-0f8d1f4b26b2,Flashpoint,9542,857613.48,2013-07-03 12:42:35,\N,12,3,icon icon-candidate ,5451.6,92,In quis justo. Maecenas rhoncus aliquam lacus.,C,vg
164f6ee2-1bff-4d15-a730-8331a99721f2,Meeveo,8689,238083.4,2014-01-24 09:24:52,\N,10,3,icon icon-candidate ,9168.78,52,Pellentesque ultrices mattis odio. Donec vitae nisi.,A,sa
16cd8721-e0f1-453e-9882-ffff38fd68ff,Twitterbridge,9331,489712.11,2013-09-29 17:59:53,\N,8,2,icon icon-candidate ,5729.57,53,Lorem ipsum dolor sit amet\t\tA,,
16dfcc05-c7dd-40a6-8b25-5073c1b34e82,Brainfire,9701,6114.05,2013-11-22 08:06:30,\N,7,1,icon icon-candidate ,5975.49,37,In hac habitasse platea dictumst. Morbi vestibulum\t\t d,,
174e2070-68ed-490d-be16-57bd4e89324b,Youspan,9595,754123.94,2013-12-11 09:20:52,\N,13,2,icon icon-candidate ,1038.54,14,Etiam faucibus cursus urna. Ut tellus. Nulla ut erat id mauris vulputate elementum.,P,ae
17934130-dfd2-4195-a587-53ffaba8faf9,Eimbee,8698,143991.37,2013-09-06 02:56:08,\N,5,1,icon icon-candidate ,4196.22,70,Donec quis orci eget orci vehicula condimentum. Curabitur in libero ut massa volutpat convallis. Morbi odio odio\t\t i,,
18920031-02a4-4945-bad6-327408cb3461,Oodoo,9075,233937.7,2013-04-10 16:02:55,\N,7,2,icon icon-candidate ,5694.63,17,Aliquam sit amet diam in magna bibendum imperdiet. Nullam orci pede\t\t s,,
18986c3e-57a4-4d0c-ad95-9fbce2714ad8,Minyx,8663,331564.55,2013-09-24 14:58:41,\N,9,3,icon icon-candidate ,560.7,13,Nulla facilisi.,D,gt
18eef3b9-7e79-4223-abb7-78e24429400b,Topiclounge,9224,714805.86,2013-10-18 19:57:54,\N,11,2,icon icon-candidate ,9268.73,83,Sed sagittis.,P,fr
193d1382-0466-4e01-909a-88bed268b75f,Browsezoom,9781,902463.11,2013-10-27 13:56:44,\N,13,3,icon icon-candidate ,2424.01,45,Phasellus sit amet erat.,D,gi
19695af2-0ed3-4a6d-bb69-2e706336d983,Centimia,5291,25130.86,2014-01-09 18:17:57,\N,3,2,icon icon-candidate ,3189.12,57,Maecenas ut massa quis augue luctus tincidunt. Nulla mollis molestie lorem.,D,gi
1a19a4bc-dc37-4717-9c4b-d0dc7fa667eb,Oyoba,7580,716053.56,2014-03-06 20:16:11,\N,11,3,icon icon-candidate ,9778.01,79,Ut tellus.,A,gl
1a36491c-6e68-4a60-b620-7c4c4cd7bbe9,Avavee,7056,704526.15,2013-11-02 22:16:51,\N,7,2,icon icon-candidate ,4872.13,18,Morbi quis tortor id nulla ultrices aliquet. Maecenas leo odio\t\t l,,
1a51ba7d-71a5-424b-a976-03c5deae96e2,Flipbug,8973,345825.62,2013-07-04 17:10:00,\N,12,2,icon icon-candidate ,5898.15,14,Pellentesque eget nunc.,D,fr
1a7ca9c1-c12f-4021-b93d-7c3c1c3c197f,Zoozzy,8976,704471.05,2013-12-28 23:29:47,\N,7,2,icon icon-candidate ,190.42,36,Curabitur convallis. Duis consequat dui nec nisi volutpat eleifend. Donec ut dolor.,C,ee
1ac54274-3176-4234-9214-e29de3823719,Gigabox,7142,677875.19,2013-08-09 11:38:14,\N,7,2,icon icon-candidate ,4202.3,99,Pellentesque eget nunc.,D,lb
1ac83f2f-aa2a-4699-a6a2-702ca3c1ed89,Topicblab,8470,104025.07,2013-11-26 18:22:01,\N,9,1,icon icon-candidate ,3504.45,67,Morbi ut odio. Cras mi pede\t\t i,,
1b942048-b65a-4b1b-9947-02ce308e0cd5,Kimia,8596,162775.57,2014-01-05 00:17:10,\N,8,4,icon icon-candidate ,8053.95,69,Fusce consequat. Nulla nisl.,D,lt
1c7ca1fa-d9bc-48aa-8151-28f75d3ebc86,Quinu,6289,165605.32,2013-05-12 15:24:54,\N,6,3,icon icon-candidate ,4562.42,48,Integer ac leo.,D,fr
1d208119-f5e9-4173-a4a2-1b01773fcc76,Agivu,8662,98780.91,2013-06-08 20:16:49,\N,7,1,icon icon-candidate ,9253.21,34,Cras pellentesque volutpat dui. Maecenas tristique\t\t e,,
1d953c9f-7c32-48be-9563-528995f30276,Ozu,9916,584120.64,2013-07-02 10:51:10,\N,8,2,icon icon-candidate ,1630.96,66,Nullam molestie nibh in lectus. Pellentesque at nulla. Suspendisse potenti.,P,lu
1e7f5fd3-6ae0-4c85-91ea-18f8a916f84b,Linklinks,9958,635217.93,2013-07-22 09:40:50,\N,10,4,icon icon-candidate ,3864.38,37,Pellentesque eget nunc. Donec quis orci eget orci vehicula condimentum. Curabitur in libero ut massa volutpat convallis.,D,fr
1e9b8a6d-c572-4b58-83e9-4416e82f1047,Meezzy,9797,876911.75,2013-09-05 06:31:52,\N,14,5,icon icon-candidate ,2374.02,96,Vestibulum ante ipsum primis in faucibus orci luctus et ultrices posuere cubilia Curae; Duis faucibus accumsan odio. Curabitur convallis. Duis consequat dui nec nisi volutpat eleifend.,C,fr
1e9cba7b-0123-4d9e-ae31-ca22703b9ed6,Riffpath,9234,615914.4,2013-11-28 04:34:03,\N,8,2,icon icon-candidate ,4859.36,54,Morbi porttitor lorem id ligula. Suspendisse ornare consequat lectus.,P,gi
1ece44dc-4c75-49d5-b173-ca84cfe6c63c,Brainverse,9835,174724.24,2013-09-03 13:04:01,\N,12,4,icon icon-candidate ,7671.23,63,Cras non velit nec nisi vulputate nonummy.,D,nl
1ee2b8ce-62d0-4058-9fbf-11c332d95541,Rhycero,8933,695606.41,2014-02-24 04:30:56,\N,10,4,icon icon-candidate ,9041.02,45,Duis at velit eu est congue elementum. In hac habitasse platea dictumst.,C,fr
1fd16963-ce7b-4760-af22-a3addd7c57e5,Skiptube,9375,494590.17,2013-06-03 05:51:34,\N,4,1,icon icon-candidate ,4309.03,15,Vestibulum ante ipsum primis in faucibus orci luctus et ultrices posuere cubilia Curae; Mauris viverra diam vitae quam.,D,si
20467038-7b80-4c91-b9ae-45f6dbb98934,Rhynoodle,9928,236917.59,2013-03-31 12:04:05,\N,10,3,icon icon-candidate ,6406.28,63,Donec vitae nisi. Nam ultrices\t\t n,,
20691fbf-7984-46c4-8eb0-8b06016022e7,Agimba,9264,791082.29,2013-07-03 09:27:56,\N,12,3,icon icon-candidate ,4282.44,18,Morbi vestibulum\t\t d,,
20a1a1a5-3d44-4762-bf06-c63d4783c4b1,Linkbuzz,8969,421388.83,2013-06-28 11:35:06,\N,12,1,icon icon-candidate ,7288.69,98,Pellentesque viverra pede ac diam.,P,al
20bddc10-4e2c-4670-aecc-92cd22bcaee5,Bubblemix,8200,294838.83,2013-11-19 05:01:36,\N,9,1,icon icon-candidate ,2428.14,20,Pellentesque eget nunc.,C,ie
20c1066a-378e-4cc9-84e0-da17e7877621,Meeveo,7595,137005.38,2013-09-18 15:16:10,\N,9,4,icon icon-candidate ,5176.37,91,Nulla ac enim. In tempor\t\t q,,
214c6626-b0b2-4262-9bb5-f7003c039fe6,Youtags,9783,88172.17,2014-02-01 01:36:54,\N,8,1,icon icon-candidate ,8081.06,35,Nunc rhoncus dui vel sem.,D,ee
21772db8-7003-4403-bf9e-220ef17735a5,Mycat,9985,185203.65,2013-06-20 07:24:27,\N,9,3,icon icon-candidate ,7998.26,53,Cras non velit nec nisi vulputate nonummy. Maecenas tincidunt lacus at velit.,D,ie
21bc2ba5-af8a-4a43-af86-2ec7a1e8d563,Brightbean,8802,935702.34,2013-07-22 18:18:54,\N,6,0,icon icon-candidate ,3628.65,63,Integer a nibh. In quis justo. Maecenas rhoncus aliquam lacus.,A,kw
21c71988-bf2d-4212-89ce-fbd5dd29db6b,Realcube,8059,132368.07,2014-01-31 10:18:02,\N,6,1,icon icon-candidate ,6860.18,40,Integer non velit.,C,kz
21ea30e4-17f0-4da8-95b7-8bbd51bab569,Devcast,9270,100164.94,2013-12-08 04:07:30,\N,12,4,icon icon-candidate ,8728.99,35,Cras in purus eu magna vulputate luctus. Cum sociis natoque penatibus et magnis dis parturient montes\t\tP,,
227bfbe2-d078-43be-b939-f8f537f5976a,Meembee,6835,677528.36,2013-10-29 18:28:58,\N,9,2,icon icon-candidate ,3369.13,49,Etiam faucibus cursus urna. Ut tellus. Nulla ut erat id mauris vulputate elementum.,D,ch
229289b1-63a0-4d5f-af57-8fb7a7070fb3,Avamm,9794,22000.74,2013-08-18 15:59:12,\N,13,4,icon icon-candidate ,4547.03,7,Duis bibendum\t\t t,,
23743cd6-5d07-4dbc-94a2-a7637490dc07,Linkbridge,8406,796309.41,2014-02-23 23:41:15,\N,6,1,icon icon-candidate ,9703.43,22,Nulla tellus. In sagittis dui vel nisl. Duis ac nibh.,C,ge
243506ef-56a6-43fb-aa3e-407760e57d9f,Bubbletube,9639,723916.91,2013-04-19 21:21:25,\N,11,1,icon icon-candidate ,3908.45,96,Curabitur gravida nisi at nibh. In hac habitasse platea dictumst.,A,az
24438a92-e467-49c1-bcfc-9cde5503a648,Browsedrive,9689,760177.42,2013-09-13 06:28:35,\N,10,6,icon icon-candidate ,7976.16,27,Mauris enim leo\t\t v,,
249e1ab6-9847-46df-8524-6684f5d7362f,Oyoyo,9018,90614.7,2014-02-26 15:37:54,\N,15,5,icon icon-candidate ,9201.98,23,Vestibulum sed magna at nunc commodo placerat. Praesent blandit.,A,ad
2507ef4a-239a-4ce6-8abc-6567c34947c7,Zoomcast,8062,590882.3,2013-10-04 02:16:39,\N,6,2,icon icon-candidate ,6903.87,57,Mauris ullamcorper purus sit amet nulla.,P,it
2512c507-3848-42c6-b8fc-50b968a3c7b8,Thoughtstorm,9786,870739.6,2013-12-02 13:43:38,\N,10,3,icon icon-candidate ,3175.13,22,Mauris lacinia sapien quis libero.,C,kz
2579fcb0-1912-44f0-9fb4-a85b9953606e,Janyx,9755,894088.71,2013-06-01 18:16:33,\N,12,3,icon icon-candidate ,7249.94,40,Morbi non lectus. Aliquam sit amet diam in magna bibendum imperdiet. Nullam orci pede\t\t s,,
257e6888-fd65-466c-801a-6ae6794b62e8,Rhynyx,9823,596691.08,2013-03-23 03:59:16,\N,9,4,icon icon-candidate ,1431.85,3,In eleifend quam a odio.,C,hu
261e9aa6-50a7-4763-b045-664d227ec1c7,Rhyzio,9603,665028.83,2013-12-03 18:22:29,\N,12,2,icon icon-candidate ,4706.99,65,Morbi ut odio. Cras mi pede\t\t i,,
268c540a-79a1-4d19-b6cd-f5f6994ebcdb,Voonder,9671,294260.25,2014-03-21 15:38:06,\N,6,1,icon icon-candidate ,8275.34,94,Duis at velit eu est congue elementum. In hac habitasse platea dictumst.,P,fi
26ad4a43-873b-4102-93a9-ea0ba66389e6,Youtags,9824,775862.45,2013-03-28 23:19:03,\N,10,2,icon icon-candidate ,9349.12,39,Integer pede justo\t\t t,,
26c17fa7-db8c-4030-a3a0-3f6f6694809a,Linklinks,9514,164522.63,2013-11-02 21:39:10,\N,10,2,icon icon-candidate ,8140.69,64,In sagittis dui vel nisl. Duis ac nibh. Fusce lacus purus\t\t f,,
2816a7f8-bfc5-453d-b057-155f8ec88f68,Jabbersphere,9990,636878.08,2013-04-21 22:49:50,\N,14,4,icon icon-candidate ,1589.5,4,Vivamus vestibulum sagittis sapien. Cum sociis natoque penatibus et magnis dis parturient montes\t\tP,,
2827ab8e-bf2b-4ac8-a4ca-ce057fa466d2,Midel,9825,60265.25,2013-10-04 02:14:06,\N,9,3,icon icon-candidate ,1709.68,88,In hac habitasse platea dictumst. Maecenas ut massa quis augue luctus tincidunt.,P,sk
284ba393-1004-4247-bf85-c602fdc00d50,Zoomdog,9192,560997.74,2013-07-11 16:42:19,\N,8,1,icon icon-candidate ,97.14,62,In congue. Etiam justo. Etiam pretium iaculis justo.,P,cr
28a5408c-f541-4485-a16f-2c3fd73c31cb,Pixonyx,6372,694612.05,2013-04-06 08:58:45,\N,10,1,icon icon-candidate ,6913.84,72,Nullam varius.,A,mc
28ce5c7f-b28e-4873-a017-43ae6e64d4a4,Jaloo,9682,986500.24,2013-11-26 01:54:45,\N,12,1,icon icon-candidate ,2845.53,95,Vivamus vestibulum sagittis sapien. Cum sociis natoque penatibus et magnis dis parturient montes\t\tA,,
29a6d3dc-2927-4207-aa7b-95529f2a88d0,Skimia,9946,970289.38,2013-07-24 12:45:23,\N,11,3,icon icon-candidate ,2338.19,99,In hac habitasse platea dictumst. Morbi vestibulum\t\t d,,
29d2dcea-8052-43c5-a613-136ce3f24d36,Jaxbean,9362,585503.95,2013-05-19 00:09:16,\N,7,1,icon icon-candidate ,7019.41,10,Morbi a ipsum. Integer a nibh.,C,es
2a491b4c-7e38-4e64-9aa4-3179afb86ccd,Livefish,9905,445943.95,2013-05-10 20:57:25,\N,9,3,icon icon-candidate ,5687.7,69,Integer ac neque.,D,kw
2a52cf23-e938-4593-9846-679193671690,Jaxbean,5670,706145.77,2013-06-27 08:00:09,\N,6,2,icon icon-candidate ,9215.18,49,Aenean fermentum. Donec ut mauris eget massa tempor convallis.,C,gr
2aa66c30-753d-41ea-a5d9-79ce885eb765,Fivechat,6260,616164.83,2013-11-05 05:11:18,\N,2,0,icon icon-candidate ,6422.6,74,Aliquam sit amet diam in magna bibendum imperdiet.,C,fr
2ac25d93-8258-47ef-8317-c1d6abd33ad6,Buzzshare,9684,341206.08,2013-08-15 00:38:17,\N,6,2,icon icon-candidate ,8905.15,48,Nam dui. Proin leo odio\t\t c,,
2ae371b8-de86-42ce-a5e9-f7f2060b3b03,Jabbercube,8893,976241.5,2013-12-01 07:00:21,\N,9,5,icon icon-candidate ,1336.95,94,Morbi vestibulum\t\t d,,
2b5f3fe8-0749-42b7-8a73-564a800ed7a6,Jayo,7678,983269.81,2013-04-24 14:31:07,\N,9,1,icon icon-candidate ,3477.57,6,Curabitur at ipsum ac tellus semper interdum.,D,fr
2bab9e53-92d6-4375-b1a5-203492952202,Tagopia,7553,892015.47,2014-02-12 04:07:54,\N,10,4,icon icon-candidate ,1020.61,1,Donec ut dolor.,D,si
2bc8081f-eae6-4b95-90dc-0b2e69d73999,Skipstorm,9533,949912.4,2014-01-15 17:16:05,\N,10,4,icon icon-candidate ,8785.77,13,Mauris ullamcorper purus sit amet nulla. Quisque arcu libero\t\t l,,
2c27ca67-4fc2-4808-ac69-fce3b7c277ed,Centidel,9640,802877.63,2013-08-15 00:25:58,\N,5,1,icon icon-candidate ,6242.45,93,Nulla justo. Aliquam quis turpis eget elit sodales scelerisque. Mauris sit amet eros.,A,ch
2c29f03e-a40b-4ea6-91c3-dcaddfc5db92,Skyble,8303,894940.09,2014-02-11 16:57:26,\N,16,6,icon icon-candidate ,5710.92,3,Integer ac leo. Pellentesque ultrices mattis odio. Donec vitae nisi.,D,ee
2c4da502-5deb-4386-8c4b-57c35fcf5fa9,Blogpad,9698,566003.05,2013-07-15 15:13:29,\N,10,3,icon icon-candidate ,2986.39,26,Mauris sit amet eros. Suspendisse accumsan tortor quis turpis. Sed ante.,A,lv
2d01d737-985a-4305-93ec-a8565c58c56a,Fatz,8878,138303.8,2013-08-25 22:42:06,\N,8,0,icon icon-candidate ,1269.53,4,Morbi sem mauris\t\t r,,
2d33212a-2265-46fc-aa2a-01c8130c3453,Voonix,9545,675394.92,2013-05-12 01:17:12,\N,6,4,icon icon-candidate ,5061.01,95,Ut tellus. Nulla ut erat id mauris vulputate elementum.,A,fr
2d7f2333-b582-4e85-8b9a-62c2084de499,Jayo,9947,330971.25,2014-01-28 07:11:16,\N,15,4,icon icon-candidate ,1502.1,55,Vestibulum ante ipsum primis in faucibus orci luctus et ultrices posuere cubilia Curae; Duis faucibus accumsan odio.,C,kz
2e97a327-169d-4432-a987-c6a62981e965,Aibox,9530,774788.72,2014-03-20 23:52:55,\N,5,0,icon icon-candidate ,4619.12,23,Integer a nibh. In quis justo. Maecenas rhoncus aliquam lacus.,A,pk
2eb0b981-c52f-49ff-a96d-ebc4a90c61dc,Divavu,8657,902462.62,2013-05-31 00:05:59,\N,7,2,icon icon-candidate ,8478.18,9,Donec ut mauris eget massa tempor convallis.,A,sk
2f0ed00f-de30-4936-ac67-3168194ffed8,Jetpulse,9975,10488.55,2013-09-21 08:46:26,\N,10,3,icon icon-candidate ,4042.85,8,Aliquam quis turpis eget elit sodales scelerisque. Mauris sit amet eros.,P,lu
2f797656-c8b2-423d-a7a1-74656f04e99d,Voolia,9030,846841.72,2013-04-13 21:51:12,\N,9,2,icon icon-candidate ,5718.14,31,Cum sociis natoque penatibus et magnis dis parturient montes\t\tA,,
2fc06086-117a-46a1-b579-300a9925a9f3,Quatz,9469,173780.08,2013-07-07 15:43:30,\N,7,4,icon icon-candidate ,5093.06,61,Integer a nibh. In quis justo. Maecenas rhoncus aliquam lacus.,P,it
3010175f-1dd4-471c-ab82-e3e2f386353a,Twimm,8751,500493.48,2013-04-22 21:39:12,\N,9,4,icon icon-candidate ,6393.33,56,Morbi ut odio.,C,pt
30474586-ec33-48df-9c1e-19f32e6fa3f9,Demizz,9843,101719.88,2013-09-26 15:39:56,\N,12,3,icon icon-candidate ,9036.72,49,Integer non velit. Donec diam neque\t\t v,,
305eb35d-9b9f-4da9-ab14-380ee5c746ca,Meemm,9532,384164.67,2013-11-20 12:45:35,\N,6,3,icon icon-candidate ,9916.64,82,Nulla ut erat id mauris vulputate elementum. Nullam varius. Nulla facilisi.,P,fr
30662b87-d9db-4473-a4e5-4f8a199a9d96,Photojam,9918,492019.35,2013-05-08 07:19:29,\N,6,1,icon icon-candidate ,8213.63,67,Duis bibendum. Morbi non quam nec dui luctus rutrum.,C,tn
3093d8cb-798b-486f-98f4-be1115b253e9,Quinu,9812,100270.14,2014-03-06 02:47:51,\N,12,3,icon icon-candidate ,7819.74,49,In hac habitasse platea dictumst.,C,rs
309a5c84-d4f9-43ea-a3cb-3a8424582821,Wikibox,9468,544826.59,2013-11-08 21:50:59,\N,7,2,icon icon-candidate ,3642.43,61,Proin at turpis a pede posuere nonummy. Integer non velit.,D,lu
3137a732-19ad-45bd-8d44-53fbaca0897f,Yodoo,8179,509847.26,2013-04-04 13:48:35,\N,8,4,icon icon-candidate ,8860.37,36,In est risus\t\t t,,
315b0c10-5450-4a45-bfa0-7e2d69a05359,Avaveo,9281,422174.17,2013-07-12 21:26:04,\N,7,1,icon icon-candidate ,3643.83,5,In hac habitasse platea dictumst. Maecenas ut massa quis augue luctus tincidunt. Nulla mollis molestie lorem.,P,cr
326a2b09-d097-4f7c-8ea1-4065e9d81ac9,Wikivu,9546,421887.21,2013-12-07 00:49:14,\N,13,6,icon icon-candidate ,2757.89,84,In tempor\t\t q,,
32f7f5a7-3e9d-4d88-a711-142850baebfa,Thoughtblab,8444,12076.74,2014-03-11 02:10:52,\N,10,2,icon icon-candidate ,3854.42,54,Sed vel enim sit amet nunc viverra dapibus. Nulla suscipit ligula in lacus. Curabitur at ipsum ac tellus semper interdum.,P,ch
