5b5446c9-8746-4bbc-ab86-895e40c08ee5,Twitternation,9153,350887.97,2013-11-28 09:59:56,\N,16,7,icon icon-candidate ,1087.36,16,Sed accumsan felis. Ut at dolor quis odio consequat varius. Integer ac leo.,P,tn
5b5dd941-ebdd-4006-ae88-d3b462d0ff06,Meedoo,9846,528248.97,2013-09-19 02:17:16,\N,9,2,icon icon-candidate ,8137.23,82,Donec dapibus.,P,ee
5b6c5f9f-5587-41d8-9ca2-6bdb034a15a0,Topiczoom,9254,107430.12,2013-09-09 09:23:58,\N,12,2,icon icon-candidate ,9165.64,16,Aenean fermentum. Donec ut mauris eget massa tempor convallis. Nulla neque libero\t\t e,,
5d331588-3249-4432-818b-b55162d8332f,Gabvine,9992,50489.92,2014-01-04 06:10:41,\N,6,2,icon icon-candidate ,1199.48,52,Mauris ullamcorper purus sit amet nulla.,A,ie
5d66c74a-18f9-4cc5-88ee-f590cf7e5abe,Flipopia,9853,628751.99,2014-03-08 14:01:18,\N,9,3,icon icon-candidate ,7556.33,23,Morbi non lectus.,A,fr
5d9e4953-45ea-47ce-9e58-1798fc0b7faf,Zoomlounge,9903,927122.42,2014-02-23 00:22:51,\N,14,4,icon icon-candidate ,5101.65,82,Curabitur convallis.,D,hr
5e1d28fe-95cb-4081-905b-eee7c69bc9ab,Skipfire,9565,522270.72,2014-03-18 05:35:06,\N,9,3,icon icon-candidate ,3929.46,4,Donec posuere metus vitae ipsum.,C,me
5e4f0698-9f0a-461e-a379-d98a95e67824,Talane,9952,721801,2013-05-14 01:56:20,\N,6,2,icon icon-candidate ,952.39,20,Maecenas tincidunt lacus at velit. Vivamus vel nulla eget eros elementum pellentesque. Quisque porta volutpat erat.,C,gi
5e530ad8-9d7a-4e2b-8a11-3f4fd5244519,Babblestorm,7966,418763.45,2014-01-18 11:28:55,\N,11,3,icon icon-candidate ,2584.39,14,Donec semper sapien a libero.,A,ge
5e7f146d-8ae9-49b5-bc7f-1b457c4d8a26,Devify,9046,517245.01,2013-12-27 14:26:51,\N,6,1,icon icon-candidate ,7595.35,77,Vestibulum ante ipsum primis in faucibus orci luctus et ultrices posuere cubilia Curae; Mauris viverra diam vitae quam. Suspendisse potenti. Nullam porttitor lacus at turpis.,P,pk
5f04d139-2bc4-4738-b5ec-961e6337ac36,Topicstorm,9487,826268,2013-07-08 07:11:22,\N,11,4,icon icon-candidate ,2835.06,46,Cras mi pede\t\t i,,
5f9c817c-b308-4572-9e4d-ee54007449ea,Jabberstorm,9998,288154.15,2013-09-23 20:20:20,\N,3,1,icon icon-candidate ,4638.38,62,Nunc purus.,A,al
603355f1-24bb-4e32-9c50-935a16a994d4,Youbridge,8725,727172.25,2013-05-14 03:27:51,\N,7,3,icon icon-candidate ,8.51,20,Sed ante. Vivamus tortor. Duis mattis egestas metus.,C,es
61007807-d2f3-4034-a11a-69070698113b,Vitz,9314,306949.53,2013-06-23 15:03:35,\N,5,0,icon icon-candidate ,3609.9,59,Vivamus vestibulum sagittis sapien. Cum sociis natoque penatibus et magnis dis parturient montes\t\tA,,
6103a8ce-9b9a-4c26-897d-f10b0bc71fdf,Eazzy,7771,4611.42,2013-11-16 02:36:47,\N,10,2,icon icon-candidate ,8482.64,30,Maecenas rhoncus aliquam lacus. Morbi quis tortor id nulla ultrices aliquet. Maecenas leo odio\t\t l,,
6196db9c-450e-4602-8d0a-7116d4859d33,Zoomlounge,9329,12058.76,2014-03-07 20:45:51,\N,9,3,icon icon-candidate ,5648.61,49,Aliquam quis turpis eget elit sodales scelerisque. Mauris sit amet eros. Suspendisse accumsan tortor quis turpis.,A,at
61cde2e9-682c-4c64-8cb7-b2a4b5792774,Browsedrive,6576,706838.89,2014-02-17 19:08:54,\N,9,0,icon icon-candidate ,7640.76,12,Proin eu mi.,P,dk
620861ea-df20-4c4d-844e-416fd0c436f5,Skinder,5777,837459.25,2013-06-14 22:35:00,\N,4,2,icon icon-candidate ,8227.96,5,Integer pede justo\t\t t,,
622bbf30-cf32-450c-a03f-e67dd6291051,Browsebug,9155,257919.25,2014-03-06 11:02:51,\N,10,2,icon icon-candidate ,5045.49,22,Cras in purus eu magna vulputate luctus. Cum sociis natoque penatibus et magnis dis parturient montes\t\tP,,
630ca806-a20f-4786-8ecb-d7b66717b6bd,Rhyloo,9282,866976.64,2014-01-12 22:10:59,\N,12,4,icon icon-candidate ,8796.6,7,Nulla facilisi. Cras non velit nec nisi vulputate nonummy. Maecenas tincidunt lacus at velit.,C,il
6368c5b3-0fe6-4259-adb7-c47b6d92f5ea,Ozu,9613,63827.13,2013-10-20 20:23:37,\N,11,5,icon icon-candidate ,7112.01,82,Praesent blandit. Nam nulla.,P,lb
63770066-01be-430e-8a42-6c4b3ec02d70,Oloo,8067,153968.14,2013-09-11 07:33:41,\N,6,3,icon icon-candidate ,4507.83,76,Proin risus. Praesent lectus.,P,ge
642681c4-b538-40c1-b2ac-bc74f06fd41f,Meetz,9319,340377.57,2013-08-10 17:50:10,\N,8,1,icon icon-candidate ,6330.23,31,In quis justo.,C,tr
64389f7c-2ed9-4b53-9dbe-86e534554f45,Trupe,9577,265035.29,2013-06-13 23:46:49,\N,6,1,icon icon-candidate ,959.35,68,Suspendisse potenti. In eleifend quam a odio.,P,hu
64a9fd43-dd29-4a61-91e1-dde5af677a78,Myworks,9401,609571.43,2013-04-25 22:45:33,\N,7,3,icon icon-candidate ,7830.34,76,Nulla nisl. Nunc nisl. Duis bibendum\t\t t,,
6524c7e4-cde7-443d-a8cf-b69499b527fd,Skimia,8328,491293.84,2013-06-12 12:29:54,\N,9,3,icon icon-candidate ,5988.37,27,Vivamus in felis eu sapien cursus vestibulum. Proin eu mi.,C,mk
652bbdda-f996-448d-9d29-8a8d80534a23,Mycat,9997,569814.79,2013-10-07 17:46:46,\N,12,3,icon icon-candidate ,420.26,62,Donec diam neque\t\t v,,
65492193-aa47-4767-9e15-6da1d24aef0a,Feedspan,9544,167084.37,2013-04-18 14:34:43,\N,12,1,icon icon-candidate ,3972.56,41,In quis justo.,D,fr
6575343b-e1cb-4a5b-9ec1-427f17d25280,Ooba,9259,414799.61,2013-04-01 01:36:12,\N,10,4,icon icon-candidate ,5756.38,59,Vestibulum ante ipsum primis in faucibus orci luctus et ultrices posuere cubilia Curae; Nulla dapibus dolor vel est.,C,il
6690a33b-d288-48fd-9f56-bec61200167d,Zoomzone,9600,883553.51,2013-10-26 01:27:32,\N,8,2,icon icon-candidate ,1847.82,44,Proin risus. Praesent lectus.,P,tr
66ad925a-f7d0-4bdf-8403-e513a5f5944c,Twitterlist,9889,361053.35,2013-04-04 16:30:41,\N,7,4,icon icon-candidate ,6277.16,80,Phasellus id sapien in sapien iaculis congue. Vivamus metus arcu\t\t h,,
66becbfc-4da0-4d07-a095-5c392e834ec2,Blogtags,9762,910025.31,2013-08-25 02:45:03,\N,10,2,icon icon-candidate ,1495.74,88,Nulla nisl. Nunc nisl. Duis bibendum\t\t t,,
6704ddf2-53b2-49f2-873b-6b7e3b1baad0,Quaxo,6946,605195.64,2014-02-25 02:15:36,\N,8,1,icon icon-candidate ,4810.14,74,Curabitur convallis.,D,is
6735edae-cf4f-45ed-a91b-d13222b473e6,Eire,9925,130308.69,2014-01-28 20:42:56,\N,8,4,icon icon-candidate ,3622.25,5,Nulla mollis molestie lorem.,C,ro
6815d0d9-97dc-44d8-9923-e2fa6bdb8ddb,Zoomzone,9526,123840.5,2013-11-22 04:19:06,\N,9,1,icon icon-candidate ,3281.83,18,Maecenas tristique\t\t e,,
681dac88-62aa-4418-86fa-8f436a3f8670,Zava,7747,768515.23,2014-01-04 20:01:31,\N,7,1,icon icon-candidate ,2681.66,66,Duis bibendum. Morbi non quam nec dui luctus rutrum.,A,tr
68258f8e-df45-4619-9523-1c475400bd91,Vinder,8233,461470.65,2014-01-14 17:29:52,\N,8,3,icon icon-candidate ,3585.25,21,In hac habitasse platea dictumst.,P,mt
68aeff12-6cfe-4b39-87f2-b0ae490ef948,Centimia,9434,128916.61,2014-03-09 02:15:58,\N,15,3,icon icon-candidate ,8920.85,17,Integer ac leo.,D,fi
68f2475d-3751-4a91-b031-eb930313e5a6,Plajo,8180,310205.49,2014-01-28 18:51:37,\N,5,1,icon icon-candidate ,7574.71,19,Maecenas ut massa quis augue luctus tincidunt.,C,mr
6a0a4c92-de1c-463c-833d-8f4a4eef1a66,Feedmix,9495,287240.96,2013-06-05 01:47:08,\N,5,1,icon icon-candidate ,3286.47,11,Donec ut dolor.,A,se
6a176647-7663-4263-b194-997eb41fa35b,Meembee,9815,749385.65,2013-11-10 02:27:55,\N,16,2,icon icon-candidate ,9117.59,41,Aenean fermentum. Donec ut mauris eget massa tempor convallis.,C,kz
6a31a12f-c4f0-4a71-8bdb-d1c145cf5f95,Wordpedia,7912,326032.47,2013-08-29 07:10:35,\N,7,1,icon icon-candidate ,2742.46,48,Integer non velit. Donec diam neque\t\t v,,
6a3ac649-04e1-431e-a399-54d91d453f35,Twiyo,9804,253306,2013-07-11 23:58:27,\N,12,3,icon icon-candidate ,9850.49,76,In hac habitasse platea dictumst. Aliquam augue quam\t\t c,,
6a8d4226-7c15-47db-8224-65ba8cf7ffb1,Zoomdog,8417,787831.31,2013-09-03 15:53:22,\N,10,5,icon icon-candidate ,4940.58,95,Nulla ut erat id mauris vulputate elementum. Nullam varius.,A,mk
6aa1e6c1-4fa4-4630-b430-82ed3e3acfa8,Meedoo,9863,683695.24,2013-05-05 18:56:09,\N,6,1,icon icon-candidate ,3277.84,7,Nulla ut erat id mauris vulputate elementum.,P,ps
6aa6cee9-154b-4afe-96c9-b6ba30811643,Vimbo,9756,789297.96,2014-01-30 21:38:10,\N,15,5,icon icon-candidate ,621.58,97,Integer tincidunt ante vel ipsum. Praesent blandit lacinia erat. Vestibulum sed magna at nunc commodo placerat.,A,lu
6af2bb7b-951f-4da7-921c-d24beceaa21c,Fivespan,7026,854653.72,2013-05-27 06:51:13,\N,7,1,icon icon-candidate ,30.11,5,Integer ac neque. Duis bibendum.,D,li
6b788c8f-a10d-4419-8f39-1d2493a268d6,Jaxspan,9674,179022.31,2013-05-30 22:26:16,\N,15,5,icon icon-candidate ,8576.99,38,Maecenas leo odio\t\t l,,
6b95320d-4e35-4130-8308-0a9d1dce1639,Jaxnation,7575,856530.2,2013-09-30 21:05:12,\N,5,1,icon icon-candidate ,4568.99,69,Integer ac leo. Pellentesque ultrices mattis odio. Donec vitae nisi.,P,ch
6b992248-d9f4-4b9e-a49b-7466893ee7aa,Pixope,9522,287158.42,2013-11-21 15:28:13,\N,12,1,icon icon-candidate ,2341.69,41,Donec ut dolor. Morbi vel lectus in quam fringilla rhoncus. Mauris enim leo\t\t v,,
6c603401-a9ae-4d5f-b83e-19bda7f9756a,Kamba,9252,265192.94,2013-12-19 20:37:09,\N,6,0,icon icon-candidate ,7787.68,2,Maecenas pulvinar lobortis est.,A,rs
6c868a7b-1e97-46fb-ab1a-08680671d089,Browseblab,8952,839863.21,2013-06-28 04:48:52,\N,11,6,icon icon-candidate ,4445.12,26,Etiam pretium iaculis justo. In hac habitasse platea dictumst.,D,ch
6d275862-903f-4874-be01-c84c9ac07315,Ainyx,9644,345269.77,2013-07-30 21:15:35,\N,10,2,icon icon-candidate ,8918.61,76,Aliquam non mauris. Morbi non lectus.,C,sa
6d6f4eb9-4e70-4297-81d3-46e04eeb1846,Eare,8435,813473.3,2013-08-20 13:57:48,\N,8,2,icon icon-candidate ,2599.59,32,Sed vel enim sit amet nunc viverra dapibus.,C,gb
6d81e65f-e15b-46f6-b696-d262e2490c76,Yodo,7128,827919.54,2014-03-17 20:24:50,\N,9,3,icon icon-candidate ,1855.14,44,Curabitur convallis. Duis consequat dui nec nisi volutpat eleifend. Donec ut dolor.,P,do
6db44811-3865-4978-9e0b-03b4a113a628,Yodo,9033,586933.78,2013-08-07 21:19:08,\N,8,1,icon icon-candidate ,8637.93,87,Phasellus id sapien in sapien iaculis congue. Vivamus metus arcu\t\t h,,
6e523c4c-f9dd-4b8c-823a-2fc143dbf326,Skynoodle,9154,704561.33,2013-12-01 13:54:15,\N,9,1,icon icon-candidate ,2747.23,10,Cum sociis natoque penatibus et magnis dis parturient montes\t\tA,,
6ee737bc-2c42-42aa-a39c-ac8de0dcb237,Divavu,9642,102330.03,2014-01-02 12:24:09,\N,7,4,icon icon-candidate ,7874.55,91,Etiam justo.,D,gl
6fbb1eac-e754-41ec-9516-0f6540971eb4,Skinix,8980,872938.83,2013-09-20 06:39:18,\N,15,3,icon icon-candidate ,6563.02,96,Donec ut mauris eget massa tempor convallis. Nulla neque libero\t\t e,,
6fcbfb77-40e5-48c9-95a8-7a4d579f416e,Zoonder,7136,151811.99,2013-07-15 16:07:56,\N,12,5,icon icon-candidate ,9967.65,66,Nulla ut erat id mauris vulputate elementum. Nullam varius. Nulla facilisi.,A,lu
6fdf2652-91b0-4539-8bec-fd4b2983903a,Eayo,9669,110826.79,2014-02-10 02:31:26,\N,9,3,icon icon-candidate ,1650.54,20,In sagittis dui vel nisl. Duis ac nibh.,D,is
701d4a62-4976-42d1-8b85-52163e3cb6ea,Izio,9703,826194.86,2013-10-26 10:53:47,\N,10,3,icon icon-candidate ,3495.51,74,Mauris sit amet eros. Suspendisse accumsan tortor quis turpis.,A,tr
702f21c6-3f0b-48ab-b4ab-75baeb8cd789,Mudo,9677,217581.17,2013-04-25 13:16:36,\N,14,4,icon icon-candidate ,7599.1,39,Curabitur gravida nisi at nibh. In hac habitasse platea dictumst.,C,mt
705db351-a12b-438b-9d3b-5c6de2fa106c,Yodo,9035,443068,2013-08-31 19:32:14,\N,9,2,icon icon-candidate ,241.66,84,Nunc purus.,D,rs
70f1149d-328a-4735-9b17-11a7e9e16086,Topicshots,9430,388685.51,2013-03-30 15:07:31,\N,11,2,icon icon-candidate ,1215.5,10,Integer tincidunt ante vel ipsum. Praesent blandit lacinia erat. Vestibulum sed magna at nunc commodo placerat.,C,fi
7102fc42-5cdc-40d4-88e3-0bfa8ae8f62b,Chatterpoint,8941,848244.97,2013-09-19 13:39:16,\N,10,4,icon icon-candidate ,954.37,80,Vivamus metus arcu\t\t h,,
71ecb047-a1b6-430e-991f-ea3d25228b9a,Skalith,8607,819283.32,2013-05-28 11:31:25,\N,10,5,icon icon-candidate ,4023.49,87,Morbi vel lectus in quam fringilla rhoncus. Mauris enim leo\t\t v,,
71f08bc1-010a-4b3c-8f3b-9ccb507685a6,Fivechat,9678,750592.82,2013-12-07 10:40:18,\N,7,0,icon icon-candidate ,3253.37,98,Etiam pretium iaculis justo. In hac habitasse platea dictumst. Etiam faucibus cursus urna.,D,cr
727547a5-01f1-4a50-85a7-4930f755ddae,Zava,8713,519082.95,2013-12-02 00:10:35,\N,13,4,icon icon-candidate ,5990.85,4,Duis aliquam convallis nunc.,C,ch
72b2b646-0d81-424b-bae0-93ec6e8ae5ab,Trunyx,8457,729276.65,2013-06-03 02:21:39,\N,9,3,icon icon-candidate ,9933.36,59,Proin interdum mauris non ligula pellentesque ultrices.,C,kz
73548c81-e391-407f-9e4f-ab9b2b0bcf66,Zoombeat,9496,458368.51,2014-01-20 02:39:31,\N,11,2,icon icon-candidate ,3165.79,38,Praesent id massa id nisl venenatis lacinia. Aenean sit amet justo. Morbi ut odio.,D,be
738e9240-a822-4b25-8d1e-fd6e47b0007f,Edgeblab,8661,449866.45,2013-07-06 12:15:17,\N,11,5,icon icon-candidate ,6332.91,51,Proin interdum mauris non ligula pellentesque ultrices. Phasellus id sapien in sapien iaculis congue.,P,ad
73bb860a-6368-4fba-9b58-8111791e05f1,Rhynyx,8043,610732.18,2013-08-23 12:22:35,\N,11,6,icon icon-candidate ,1246.2,36,Cum sociis natoque penatibus et magnis dis parturient montes\t\tD,,
73db8e49-3883-47ca-be62-2679677f96a1,Gabtype,8826,135959.1,2013-08-10 06:01:35,\N,9,2,icon icon-candidate ,3968.16,45,Mauris enim leo\t\t v,,
740461da-7e33-4503-a494-051bd607b756,Plajo,9173,670354.34,2013-12-31 15:57:30,\N,6,3,icon icon-candidate ,2668.98,79,Curabitur gravida nisi at nibh. In hac habitasse platea dictumst.,C,al
74109e24-c7c1-4cf4-bffc-90d9db774ff4,Cogidoo,9957,593922.6,2013-07-29 19:00:47,\N,13,4,icon icon-candidate ,8715.07,72,Morbi ut odio.,C,fr
7425d8a8-02ff-42fb-b37d-7d2a3c58bb06,Yacero,9884,132288.64,2013-04-04 00:45:48,\N,8,4,icon icon-candidate ,544.43,6,Morbi odio odio\t\t i,,
742e3d6e-e672-464a-9d13-2691f7f2c886,Kaymbo,9964,505715.86,2014-02-20 19:49:01,\N,11,4,icon icon-candidate ,2625.74,59,In congue. Etiam justo.,D,is
74570bf2-5a46-4f54-9965-d07d8c7fdb33,Quimba,9557,989191.07,2014-03-08 07:00:17,\N,12,2,icon icon-candidate ,3588.7,55,Donec posuere metus vitae ipsum. Aliquam non mauris. Morbi non lectus.,D,si
746a478f-7cb0-4728-8d47-8058aa3adae1,Ainyx,9438,960087.95,2013-07-22 20:24:49,\N,12,3,icon icon-candidate ,2656.89,58,Suspendisse accumsan tortor quis turpis.,D,ps
7473a93b-e660-43e1-b3e1-948ec2fa2dd9,Flipbug,9844,842820.32,2013-09-07 07:18:11,\N,16,4,icon icon-candidate ,9927.37,88,Suspendisse ornare consequat lectus.,P,mr
74c618fa-00ab-4f01-ac56-f84790bd33a7,Dabshots,8588,463729,2013-08-26 03:57:38,\N,11,4,icon icon-candidate ,1859.24,53,Suspendisse ornare consequat lectus. In est risus\t\t t,,
7509c380-361d-4880-b9fd-933e64afaf34,Edgeify,9386,363362.88,2013-07-25 06:13:07,\N,8,3,icon icon-candidate ,4869.32,11,Donec odio justo\t\t s,,
7519ea6a-bd8e-4503-9021-955ea9a99a99,Skilith,8391,771525.21,2014-03-01 00:35:27,\N,3,0,icon icon-candidate ,5167.34,67,Integer pede justo\t\t t,,
752334e9-993a-475e-a032-64197c01df4f,Twinder,9225,148830.76,2013-10-13 16:04:22,\N,6,4,icon icon-candidate ,7107.17,44,Lorem ipsum dolor sit amet\t\tA,,
75484fbf-ed97-4860-bbde-7d23247e5572,Fiveclub,9789,590146.61,2013-04-14 08:56:47,\N,20,6,icon icon-candidate ,1251.22,91,Vivamus vestibulum sagittis sapien. Cum sociis natoque penatibus et magnis dis parturient montes\t\tA,,
75628be6-4d05-4890-ab89-6ff1155f1c64,Kayveo,7767,118082.12,2013-05-20 15:48:59,\N,3,0,icon icon-candidate ,8979.56,65,Nulla tempus. Vivamus in felis eu sapien cursus vestibulum. Proin eu mi.,A,fi
761cf472-378d-46e8-8b66-771a13918d79,Jaxspan,9620,185451.79,2013-11-14 20:04:59,\N,16,4,icon icon-candidate ,4610.72,99,Sed ante.,D,mr
76391353-52fa-4edc-a995-6c4d5594f2eb,Zoovu,9936,799629.14,2013-07-25 06:00:24,\N,12,4,icon icon-candidate ,1895.92,79,Integer tincidunt ante vel ipsum.,P,tr
7640b979-abd6-4b50-bb42-74596159e2c3,Buzzdog,8636,207327.83,2013-04-23 06:31:51,\N,9,3,icon icon-candidate ,9753.28,54,Cras mi pede\t\t i,,
76511385-389a-4328-8941-5518800211ee,Meedoo,9574,401908.62,2013-11-06 04:34:59,\N,7,0,icon icon-candidate ,7339.03,34,Morbi non quam nec dui luctus rutrum.,C,il
76982f22-645a-448d-ad14-a0da12fd6970,Quimm,9848,10944.81,2013-09-06 05:38:32,\N,7,1,icon icon-candidate ,7258.64,65,In hac habitasse platea dictumst.,P,pt
76bbe79b-8452-4017-9a1b-58cc24b7297a,Camido,9507,437566.16,2013-10-07 06:19:00,\N,15,3,icon icon-candidate ,4853.9,85,Vestibulum ac est lacinia nisi venenatis tristique.,A,cy
76ec5faf-2672-4b36-ac47-a54e5b8b98af,Wikivu,9128,981205.78,2013-10-21 14:32:26,\N,8,3,icon icon-candidate ,7044.08,74,Maecenas pulvinar lobortis est. Phasellus sit amet erat. Nulla tempus.,A,fi
7701e868-0a56-43e2-93b0-fbba56ff5b27,Centimia,9909,597940.54,2013-10-26 11:56:00,\N,11,2,icon icon-candidate ,1009.49,5,Phasellus sit amet erat. Nulla tempus. Vivamus in felis eu sapien cursus vestibulum.,C,no
7715dd58-2819-4d91-ae47-9fcb7d315a22,Flipbug,7886,551517.01,2013-12-11 10:07:22,\N,11,4,icon icon-candidate ,514.79,69,Integer tincidunt ante vel ipsum.,C,pl
771ac220-78d0-4845-bc2c-f7df34ce63ed,Blogtags,9376,40218.43,2013-12-03 16:45:02,\N,9,1,icon icon-candidate ,6792.53,66,Vivamus in felis eu sapien cursus vestibulum. Proin eu mi. Nulla ac enim.,C,fr
7754a240-7627-4ec8-9e8e-60eaa270d69d,Aimbo,9912,100864.11,2013-10-10 08:47:08,\N,9,1,icon icon-candidate ,9279.71,39,Suspendisse ornare consequat lectus. In est risus\t\t t,,
7777a2aa-3ccc-4dcd-9939-adc33ca26445,Dabshots,9599,425559.9,2013-12-19 12:43:33,\N,13,4,icon icon-candidate ,3673.81,67,Fusce consequat. Nulla nisl. Nunc nisl.,A,hr
779b2336-5fc5-473c-bd8c-69872a76788d,Browsetype,9387,383344.15,2013-12-13 04:15:06,\N,6,4,icon icon-candidate ,6535.33,57,Nam nulla. Integer pede justo\t\t t,,
77b98ecf-90f8-4ba8-86b6-f66a809947df,Gabspot,9399,67448.07,2013-08-28 14:57:42,\N,12,0,icon icon-candidate ,1090.35,91,Morbi non quam nec dui luctus rutrum.,D,mt
782d1c1f-db02-4d09-ab1a-12ee07ccc854,Voomm,9235,286602.47,2013-05-20 18:51:08,\N,8,2,icon icon-candidate ,5970.73,20,In quis justo. Maecenas rhoncus aliquam lacus.,A,pk
7863f440-5b32-4438-b2b8-bcf706e427b7,Vinte,8368,998192.47,2013-04-28 14:21:19,\N,8,2,icon icon-candidate ,6272.22,22,Morbi ut odio. Cras mi pede\t\t i,,
787ea386-ac9d-4c9c-b696-d59b50ce0fa4,Photofeed,8236,977432.67,2014-02-17 22:02:39,\N,11,3,icon icon-candidate ,3574.39,72,Curabitur at ipsum ac tellus semper interdum. Mauris ullamcorper purus sit amet nulla.,D,es
789d6d83-0a61-4c36-b063-af6cb32d2d2d,Midel,9885,919254.95,2014-03-18 14:51:51,\N,9,3,icon icon-candidate ,7785.85,37,Nulla tempus. Vivamus in felis eu sapien cursus vestibulum. Proin eu mi.,D,gb
78d43b3d-ed9b-4a17-a15f-c69b297e5db9,Zoombeat,9618,631036.03,2013-10-20 19:15:25,\N,13,3,icon icon-candidate ,2937.26,60,Duis bibendum\t\t t,,
78f7fba2-9a54-4293-af20-dfb382a7e5fd,Buzzster,7989,526823.67,2013-12-09 04:33:03,\N,9,2,icon icon-candidate ,9521.31,51,Morbi porttitor lorem id ligula.,P,fi
79691323-e0bc-44a0-8ebb-80128dd8ca80,Babbleopia,7479,766664.09,2013-11-06 13:04:02,\N,5,4,icon icon-candidate ,1002.03,3,Curabitur in libero ut massa volutpat convallis. Morbi odio odio\t\t i,,
797fb574-f189-4227-8562-bc73353f736b,Dabshots,9323,49909.17,2014-02-16 20:57:19,\N,10,5,icon icon-candidate ,9806.49,92,Curabitur convallis. Duis consequat dui nec nisi volutpat eleifend.,P,kz
79ac3b02-90aa-4664-b253-1981208f3a66,Yotz,7473,172588.14,2013-07-20 22:04:51,\N,8,3,icon icon-candidate ,1162.32,1,Suspendisse potenti.,A,md
7a00dc5f-eecf-4366-85f8-77a993c902f0,Brainfire,9664,311868.29,2013-08-17 03:50:42,\N,12,3,icon icon-candidate ,7758.06,53,Vivamus tortor. Duis mattis egestas metus. Aenean fermentum.,C,it
7a035f7e-1ec6-49a3-84d0-ae65305b3e82,Buzzshare,9134,494992.58,2013-06-07 14:25:33,\N,9,3,icon icon-candidate ,5542.31,86,Integer a nibh. In quis justo.,A,fr
7a2fab8e-8a6d-40e5-ac3a-a661b30b57a9,Shufflebeat,8870,457740.49,2013-05-23 07:27:08,\N,13,5,icon icon-candidate ,8370.37,80,Morbi sem mauris\t\t r,,
7ac683c7-552c-4c1a-9150-dc98b01b501b,Tazz,9344,315464.31,2013-06-04 18:36:26,\N,8,1,icon icon-candidate ,4182.28,99,Cum sociis natoque penatibus et magnis dis parturient montes\t\tA,,
7ac86432-6c37-4932-bce7-fd54b57303ff,Yoveo,9861,523439.58,2013-06-07 10:01:46,\N,7,1,icon icon-candidate ,3551.43,77,Proin risus. Praesent lectus.,D,lt
7b0f05c8-985b-4ffc-b5b1-c19530ea9400,Bubbletube,9902,456228.71,2013-12-15 05:30:15,\N,9,1,icon icon-candidate ,4975.37,10,Donec diam neque\t\t v,,
7b662bc7-8f5f-4d0d-b87d-74db4c655ea7,Feedfire,9809,882033.95,2014-02-01 12:33:03,\N,11,2,icon icon-candidate ,8425.65,1,Vestibulum ante ipsum primis in faucibus orci luctus et ultrices posuere cubilia Curae; Nulla dapibus dolor vel est.,P,ba
7b80127f-8b05-41cc-bd54-9c26baacea2c,Flashpoint,9930,173936.11,2013-03-28 19:46:50,\N,10,2,icon icon-candidate ,7717.33,86,Praesent blandit.,A,az
7bb0c2de-f9a0-4144-9922-c529cf958e8a,Innotype,9725,836259.54,2013-03-28 22:48:10,\N,9,4,icon icon-candidate ,1328.83,93,Aliquam sit amet diam in magna bibendum imperdiet. Nullam orci pede\t\t s,,
7bf84381-9593-479a-8dd3-af86487135a8,Ooba,8489,439357.77,2013-06-05 04:40:13,\N,7,4,icon icon-candidate ,430.71,59,Ut at dolor quis odio consequat varius. Integer ac leo. Pellentesque ultrices mattis odio.,P,fr
7c483d63-f169-4077-9bce-39a827f4afe7,Edgewire,9710,415167.27,2013-12-05 07:07:37,\N,17,5,icon icon-candidate ,2905.07,39,Fusce consequat. Nulla nisl.,A,lv
7cc3471f-df73-401b-bd9f-eec02c9096e2,Gevee,9351,761872.24,2013-06-28 14:15:08,\N,11,2,icon icon-candidate ,6349.1,31,Praesent blandit.,D,al
7d7df08b-5a97-46e2-9647-6ca0f9d9d4b8,Meemm,9568,537142.42,2014-01-03 05:55:17,\N,10,4,icon icon-candidate ,6011.04,17,Aliquam sit amet diam in magna bibendum imperdiet. Nullam orci pede\t\t s,,
7db94db4-0dab-4f40-a822-cc0ffff2c8d7,Realcube,9753,255200.41,2013-06-11 14:52:05,\N,10,3,icon icon-candidate ,332.62,26,Etiam faucibus cursus urna. Ut tellus.,P,me
7df9673b-093a-4e06-ada0-7be38e3c9b4b,Jatri,9826,36115.86,2013-04-11 19:21:24,\N,8,3,icon icon-candidate ,9351.68,76,Duis aliquam convallis nunc.,D,fr
7e682631-a349-4079-b316-6af8b129e244,Katz,9587,641525.48,2014-02-06 20:46:30,\N,12,4,icon icon-candidate ,265.52,1,Integer pede justo\t\t t,,
7e7e0d79-7c96-44bb-b38d-8b96bc3cd01b,Edgewire,9150,744193.51,2013-09-17 13:20:39,\N,7,2,icon icon-candidate ,7189.9,68,Morbi a ipsum. Integer a nibh.,P,fr
7e8372c4-5198-4e73-8373-cb145d1aa5a1,Tanoodle,9935,867294.21,2013-04-12 01:27:40,\N,11,0,icon icon-candidate ,8972.94,53,Morbi non lectus. Aliquam sit amet diam in magna bibendum imperdiet.,C,fr
7e87a96e-cb14-4b3a-96ac-10d9842163e6,Pixoboo,9121,316606.91,2014-02-13 16:29:41,\N,13,2,icon icon-candidate ,272.19,79,Ut at dolor quis odio consequat varius.,A,kw
7ed678e8-f027-4fda-b655-243fe7e06d2f,Innojam,9927,492893.15,2013-07-14 11:12:46,\N,12,2,icon icon-candidate ,491.05,87,Integer aliquet\t\t t,,
7f23b5a4-6a7c-4396-b1a3-7b6dbecc2ebb,Ntags,9868,558788.32,2013-11-29 12:47:32,\N,8,4,icon icon-candidate ,1152.13,22,Nam ultrices\t\t n,,
7fab75f1-4ebc-4015-98cb-0411b217e09f,Myworks,9609,920477.69,2013-08-09 14:33:26,\N,10,2,icon icon-candidate ,4927.92,14,In quis justo.,D,es
7fe414e9-a899-42d8-be44-359133ceb625,Lajo,8845,56237.03,2013-09-18 13:17:45,\N,5,1,icon icon-candidate ,998.32,60,Suspendisse accumsan tortor quis turpis.,C,pt
7ffb2508-3a22-4de3-81f3-aae2bcc1b26d,Nlounge,8459,701252.4,2014-03-12 21:22:59,\N,12,1,icon icon-candidate ,7197.21,62,Praesent id massa id nisl venenatis lacinia. Aenean sit amet justo. Morbi ut odio.,A,it
806ff3ef-ac5b-45da-8145-8ce2520a6d0c,Roombo,7577,607792.24,2014-03-16 09:10:50,\N,11,2,icon icon-candidate ,4464.77,70,Praesent lectus.,D,gl
80a0fffd-2ab0-43e1-92df-0fd069aef434,Roombo,9849,984251.66,2013-07-26 00:47:54,\N,5,3,icon icon-candidate ,2694,29,Integer pede justo\t\t t,,
80d488a5-8d1d-4414-99fc-e4d76969ef55,Meejo,7978,709695.99,2013-07-30 17:56:02,\N,14,3,icon icon-candidate ,9685.96,85,Etiam pretium iaculis justo.,A,mk
81163e58-e6da-4211-821e-485da4bd19e3,Fadeo,9939,73145.2,2013-09-10 09:42:34,\N,11,3,icon icon-candidate ,4934.3,33,Cras in purus eu magna vulputate luctus.,P,mr
81295bd4-224b-441d-b335-910c6d25a4ed,Rhybox,9757,917485.49,2013-12-28 12:58:28,\N,19,7,icon icon-candidate ,533.81,66,Integer ac neque. Duis bibendum.,C,mu
814f656b-25a4-4687-b6ec-4c95041e543e,Eidel,8777,928735.89,2014-02-10 05:10:56,\N,9,3,icon icon-candidate ,5708.38,26,Integer a nibh. In quis justo. Maecenas rhoncus aliquam lacus.,D,md
815b8d64-26e3-4972-8d9c-83b0ea7a96bc,Skyba,9937,77682.59,2013-10-06 06:19:18,\N,14,5,icon icon-candidate ,1457.69,76,Pellentesque eget nunc. Donec quis orci eget orci vehicula condimentum. Curabitur in libero ut massa volutpat convallis.,A,vg
81bf16da-5ec7-4677-b156-c874d42aecb7,Yadel,8818,128609.74,2013-05-29 23:23:14,\N,10,3,icon icon-candidate ,9075.22,64,Curabitur at ipsum ac tellus semper interdum.,C,fr
821f4f85-c693-4e5f-bcc4-1c9a8b545211,Feedfish,8022,964841.13,2013-11-06 19:42:55,\N,6,2,icon icon-candidate ,3755.77,97,Quisque porta volutpat erat.,D,fr
8221042a-71ec-46fb-9ba7-6056185d5953,Ooba,9397,136154.2,2013-10-09 10:43:53,\N,10,4,icon icon-candidate ,4860.44,74,Suspendisse potenti. Nullam porttitor lacus at turpis.,D,ba
82599e4b-1a84-41d9-a825-25db42e5d657,Ailane,9144,760591.94,2013-07-17 09:34:23,\N,9,3,icon icon-candidate ,8239.11,37,Morbi porttitor lorem id ligula. Suspendisse ornare consequat lectus. In est risus\t\t t,,
831215f7-675a-4571-8fb6-600a63530100,Demimbu,8615,691133.05,2014-02-11 00:55:34,\N,8,3,icon icon-candidate ,7663.26,62,Nullam porttitor lacus at turpis. Donec posuere metus vitae ipsum.,D,lu
8328b0a9-26bc-4b27-ab4e-abbaeef45331,Yoveo,9738,265479.75,2013-06-26 11:05:15,\N,14,3,icon icon-candidate ,3703.18,74,In tempor\t\t q,,
836479d2-4c40-43d2-96df-d21f2f07b3dc,Realcube,9739,658670.2,2013-06-20 00:07:43,\N,6,0,icon icon-candidate ,4503.98,33,Aenean fermentum. Donec ut mauris eget massa tempor convallis.,A,si
83875245-6b90-4aa3-a701-59faf146c06c,Jabbercube,9959,947645.19,2013-05-02 00:14:12,\N,17,4,icon icon-candidate ,4003.14,64,Cras non velit nec nisi vulputate nonummy. Maecenas tincidunt lacus at velit. Vivamus vel nulla eget eros elementum pellentesque.,D,rs
